{
  "identity": {
    "naics": "423440",
    "title": "Other Commercial Equipment Merchant Wholesalers",
    "run_id": "423440-a1-20260722",
    "model_id": "claude-sonnet-5",
    "run_date": "2026-07-22",
    "methodology_version": "5.1",
    "attempt": 1
  },
  "lens": {
    "included_activities": "Independent commercial-equipment distributors in the lower-middle-market EBITDA band that repeatedly serve external restaurant, food-retail, institutional, or other commercial customers with equipment specification, project coordination, installation, preventive maintenance, repair, parts, or related accountable service.",
    "excluded_activities": "Product-only catalog sellers, manufacturers and captive sales branches, consumer retailers, pure rental companies, commission-only agents, internal maintenance units, shells, and non-control financing vehicles.",
    "customer_and_revenue_model": "Customers purchase commercial machines, fixtures, shelving, scales, and related equipment at product margins, then buy repeat project, installation, maintenance, repair, parts, or annual-service work through contracts and work orders.",
    "deviation_from_default": "The code is heterogeneous across restaurant equipment, store fixtures, shelving, scales, and other commercial machines, and many establishments are product-only. The lens is narrowed to distributors with a material recurring or repeat accountable service component to keep the screen coherent.",
    "heterogeneous": true
  },
  "primitives": {
    "a": {
      "evidence_state": "PROXY",
      "low": 0.17,
      "base": 0.29,
      "high": 0.41,
      "bridge": "BLS reports occupations for the broader 423400 professional and commercial equipment wholesale industry, while Global Industrial reports its own distributor workforce; neither measures wage-weighted not-yet-automated tasks in eligible 423440 firms. I map the observed sales, customer service, administration, IT, product management, and support work to general task-level AI evidence, while treating warehouse, installation, and field-repair work as much less exposed. The public distributor and broad NAICS mix may overstate digital scale and understate field labor in LMM service dealers.",
      "rationale": "Quoting, product selection, proposal drafting, order entry, scheduling, parts identification, service triage, documentation, purchasing, and back-office work are materially exposed. BLS identifies technical sales, other sales, customer service, management, software, and support among the largest 423400 occupations; Global Industrial reports 36% of staff customer-facing and 37% in administrative functions, but physical distribution and equipment service remain important.",
      "change_evidence": "A payroll-weighted O*NET task inventory and current-automation audit from a representative sample of 423440 equipment distributors, split among inside sales, project teams, warehouse, installers, and field technicians.",
      "source_ids": ["S1", "S2", "S3", "S6"],
      "caveats": ["Occupation evidence is at 423400, not six-digit 423440.", "Global Industrial spans broader industrial products and is much larger than the target firms.", "General AI evidence measures exposure or use, not removable labor."]
    },
    "rho": {
      "evidence_state": "ESTIMATE",
      "low": 0.31,
      "base": 0.50,
      "high": 0.68,
      "rationale": "Five-year implementation should be feasible for product search, quote preparation, service intake, dispatch support, technician knowledge retrieval, invoice matching, and routine customer communications. Realization is limited by fragmented catalogs and legacy ERPs, sparse equipment histories, safety and warranty rules, technician acceptance, and the need for human verification before specifying or servicing physical equipment.",
      "change_evidence": "Measured deployments at multi-branch equipment distributors showing adoption, exception and rework rates, technician utilization, quote cycle time, hours removed, and sustained hiring avoidance by workflow.",
      "source_ids": ["S3", "S6"],
      "caveats": ["No representative 423440 implementation study was found.", "AI use observed on consumer chat products may not transfer to field-service systems.", "Small distributors may lack clean product and service data."]
    },
    "e": {
      "evidence_state": "ESTIMATE",
      "low": 0.10,
      "base": 0.24,
      "high": 0.41,
      "rationale": "Official NAICS scope is merchant wholesale of commercial machines generally used in restaurants and stores, not a service industry. However, commercial food-equipment evidence shows installation, repair, parts, and separately sold annual service contracts are natural adjuncts to equipment. A meaningful but minority share of the frozen LMM population is therefore likely to meet the repeat-service lens.",
      "change_evidence": "A firm-level 423440 census classifying LMM distributors by service technicians, maintenance offerings, installation capability, service-contract revenue, and product-only status.",
      "source_ids": ["S5", "S7"],
      "caveats": ["The frozen n is derived using broad distributor margins that may misclassify service-rich firms by EBITDA band.", "Manufacturer service models demonstrate the activity but not its prevalence among independent wholesalers.", "Eligibility likely varies sharply by equipment niche."]
    },
    "s5": {
      "evidence_state": "PROXY",
      "low": 0.11,
      "base": 0.18,
      "high": 0.29,
      "bridge": "Census owner-age evidence covers U.S. employer businesses and demographic groups in wholesale trade rather than observing control transfers in eligible 423440 firms. I convert the large older-owner stock into a five-year event probability after discounting for owners who retain, close, transfer internally, or lack transferable operations. Age can overstate near-term sales, while strategic consolidation may create transfers unrelated to retirement.",
      "rationale": "Census reports 51% of responding employer-business owners were 55 or older and separately identifies wholesale trade as an older-owner sector. Because owner age is only a precursor, not a transfer, the qualifying five-year probability is set far below the older-owner share.",
      "change_evidence": "Closed transaction and closure records from GF Data, PitchBook, Axial, BizBuySell, and equipment-dealer brokers, matched to a denominator of eligible 423440 LMM firms and tagged for control, succession, and continued operation.",
      "source_ids": ["S4", "S5"],
      "caveats": ["Broad and subgroup-specific age data are weak predictors of transaction timing.", "No denominator-complete six-digit deal series was found.", "Family succession and manufacturer dealer-authorizations may affect transferability."]
    },
    "q": {
      "evidence_state": "ESTIMATE",
      "low": 0.44,
      "base": 0.64,
      "high": 0.80,
      "rationale": "Urgent repair, preventive maintenance, and bundled project work permit more retention than transparent product resale, particularly under annual service contracts. Product channels remain fragmented and price-sensitive: Global Industrial says buyers emphasize price, selection, availability, service, terms, and convenience and face manufacturers, internet sellers, and large retailers. Savings will partly pass through at renewal or competitive bid, but field-service capacity and response accountability provide some insulation.",
      "change_evidence": "Contract-level gross-profit cohorts for LMM equipment distributors before and after automation, separated into equipment, projects, annual service, break/fix labor, and parts, with renewal repricing and win/loss data.",
      "source_ids": ["S6", "S7"],
      "caveats": ["Public manufacturer and distributor economics are only directional for independent LMM dealers.", "Gross margin is not direct evidence of AI-benefit retention.", "Emergency repair and bid equipment sales have very different pricing power."]
    },
    "d5": {
      "evidence_state": "ESTIMATE",
      "low": 0.88,
      "base": 1.03,
      "high": 1.21,
      "rationale": "Installed commercial equipment creates recurring parts, compliance, repair, and replacement needs, while restaurant openings, remodels, and automation can add demand. Near-term equipment demand is cyclical: Middleby reported a 1.7% organic decline in commercial foodservice equipment sales in 2025 and cited weaker chain traffic and replacement demand. The five-year constant-price range therefore centers near flat with room for recessionary contraction or recovery-led growth.",
      "change_evidence": "A five-year constant-price forecast for 423440 shipments and service work by equipment niche, supported by distributor backlog, restaurant and retail openings, installed-base age, replacement cycles, and service-call volumes.",
      "source_ids": ["S7", "S8"],
      "caveats": ["Middleby is a global manufacturer, not a U.S. merchant wholesaler.", "Reported sales include price, currency, acquisition, and share effects.", "The code combines end markets with different cycles."]
    },
    "o": {
      "evidence_state": "ESTIMATE",
      "low": 0.75,
      "base": 0.88,
      "high": 0.96,
      "rationale": "Simple replenishment and product discovery can migrate to marketplaces or manufacturer-direct channels, but eligible firms coordinate physical specification, delivery, installation, acceptance, maintenance, repair, parts, and on-site safety. ITW reports annual service contracts recognized over the service period and on-demand repairs recognized after completion and customer acceptance, illustrating durable accountable-operator work that software alone cannot supply.",